{
  "schema_version": 2,
  "subject_id": "fixture-http-sink",
  "version": "v2.0.0",
  "status": "revoked",
  "completion_class": "subject-definitive",
  "core_policy_version": "2.0.0-draft.1",
  "coverage_epoch": "2026-08-28",
  "coverage_states": ["covered"],
  "artifact_digest": "sha256:38b9e0e5a03b973da837856ccc25f939b6ed1e76d87ebc2a226d7edb8b5d6294",
  "valid_from": "2026-08-28T00:00:00Z",
  "valid_until": "2027-08-28T00:00:00Z",
  "revocation": {
    "revoked_at": "2026-08-28T06:00:00Z",
    "reason": "fixture-compromise"
  }
}
